{
  "schema": "https://example.org/dikwp/shengzhou/28/personal-continuity-package",
  "version": "28.0.0",
  "mode": "SHENGZHOU28_AGI_DISCONTINUITY_LIFE_FLOOR_INFORMATION_INTEGRITY_DIGITAL_SOVEREIGNTY_COMMUNITY_RECOVERY_REALITY_CLOSURE",
  "generatedAt": "2026-09-06T10:57:07.316228Z",
  "profile": {
    "displayName": "Lin Household — synthetic example",
    "householdSize": 3,
    "children": 1,
    "olderAdults": 0,
    "disabilityOrMedicalDependency": false,
    "pets": 1,
    "jurisdiction": "Local jurisdiction"
  },
  "preparedness": {
    "waterDays": 3,
    "foodDays": 12,
    "medicationDays": 14,
    "hygieneDays": 7,
    "kitCompletion": 0.74,
    "medicalSummary": true,
    "firstAid": true,
    "prescriptionCopies": true,
    "careBackup": true,
    "professionalSupportContact": true,
    "powerBackupHours": 18,
    "shelterPlan": true,
    "smokeAlarm": true,
    "utilityShutoffKnowledge": true,
    "alternativeTemperaturePlan": true,
    "trustedContacts": 4,
    "outOfAreaContact": true,
    "meetingPoints": 2,
    "offlineRadio": true,
    "paperContacts": true,
    "twoChannelVerification": true,
    "documentCopies": true,
    "recoveryCodes": true,
    "cleanDevicePlan": true,
    "officialAccountContacts": true,
    "secureStorage": true,
    "cashDays": 5,
    "reserveDays": 45,
    "paymentRails": 3,
    "incomeSources": 2,
    "billList": true,
    "fraudFreezePlan": true,
    "mfaCoverage": 0.92,
    "passwordManager": true,
    "offlineBackups": 2,
    "softwareUpdates": true,
    "accountRecovery": true,
    "oauthReview": true,
    "officialSources": 5,
    "twoSourceRule": true,
    "pauseBeforeShare": true,
    "rumorLog": true,
    "offlineSourceList": true,
    "sourceDiversity": true,
    "humanConfirmCritical": true,
    "noAutoTransfer": true,
    "noAutoContract": true,
    "revocationPlan": true,
    "agentInventory": true,
    "leastPrivilege": true,
    "goBag": true,
    "routes": 2,
    "transportBackup": true,
    "destinationPlan": true,
    "petPlan": true,
    "mutualAidContacts": 4,
    "vulnerableCheck": true,
    "skillOffer": true,
    "sharedResources": true,
    "localOrganizations": true,
    "transferableSkills": 4,
    "workEvidence": 3,
    "ninetyDayIncomePlan": true,
    "localServiceSkill": true,
    "checkInPeople": 3,
    "sleepPlan": true,
    "calmProtocol": true,
    "mediaLimit": true,
    "dependentRoutine": true,
    "drillsCompleted": 2
  },
  "worlds": [
    {
      "id": "rapid_automation",
      "weight": 0.16,
      "severity": 1.0
    },
    {
      "id": "ai_fraud",
      "weight": 0.14,
      "severity": 1.0
    },
    {
      "id": "cyber_identity",
      "weight": 0.14,
      "severity": 1.0
    },
    {
      "id": "cloud_payment_outage",
      "weight": 0.13,
      "severity": 1.0
    },
    {
      "id": "essential_services",
      "weight": 0.13,
      "severity": 1.0
    },
    {
      "id": "autonomous_agent_incident",
      "weight": 0.12,
      "severity": 1.0
    },
    {
      "id": "local_relocation",
      "weight": 0.1,
      "severity": 1.0
    },
    {
      "id": "compound_crisis",
      "weight": 0.08,
      "severity": 1.0
    }
  ],
  "readiness": {
    "base": {
      "supplies": 0.8992857142857142,
      "health": 1.0,
      "shelter": 0.95,
      "communication": 1.0,
      "identity": 1.0,
      "finance": 0.9714285714285713,
      "digital": 0.9866666666666667,
      "information": 1.0,
      "ai_authority": 1.0,
      "mobility": 1.0,
      "community": 1.0,
      "psychological": 1.0
    },
    "worlds": [
      {
        "id": "rapid_automation",
        "name": "Rapid automation and income shock",
        "weight": 0.16,
        "severity": 1.0,
        "scores": {
          "supplies": 0.8273428571428572,
          "health": 0.9,
          "shelter": 0.874,
          "communication": 0.96,
          "identity": 0.96,
          "finance": 0.4662857142857142,
          "digital": 0.888,
          "information": 0.82,
          "ai_authority": 0.78,
          "mobility": 0.9,
          "community": 0.82,
          "psychological": 0.62
        },
        "floor": 0.4662857142857142,
        "weakest": [
          [
            "finance",
            0.4662857142857142
          ],
          [
            "psychological",
            0.62
          ],
          [
            "ai_authority",
            0.78
          ]
        ]
      },
      {
        "id": "ai_fraud",
        "name": "AI-enabled fraud, impersonation and influence",
        "weight": 0.14,
        "severity": 1.0,
        "scores": {
          "supplies": 0.8633142857142856,
          "health": 0.86,
          "shelter": 0.9119999999999999,
          "communication": 0.52,
          "identity": 0.52,
          "finance": 0.4662857142857142,
          "digital": 0.6117333333333334,
          "information": 0.41999999999999993,
          "ai_authority": 0.5,
          "mobility": 0.88,
          "community": 0.72,
          "psychological": 0.7
        },
        "floor": 0.41999999999999993,
        "weakest": [
          [
            "information",
            0.41999999999999993
          ],
          [
            "finance",
            0.4662857142857142
          ],
          [
            "ai_authority",
            0.5
          ]
        ]
      },
      {
        "id": "cyber_identity",
        "name": "Cyber compromise and identity lockout",
        "weight": 0.14,
        "severity": 1.0,
        "scores": {
          "supplies": 0.8273428571428572,
          "health": 0.82,
          "shelter": 0.855,
          "communication": 0.58,
          "identity": 0.4,
          "finance": 0.48571428571428565,
          "digital": 0.37493333333333334,
          "information": 0.66,
          "ai_authority": 0.54,
          "mobility": 0.84,
          "community": 0.78,
          "psychological": 0.72
        },
        "floor": 0.37493333333333334,
        "weakest": [
          [
            "digital",
            0.37493333333333334
          ],
          [
            "identity",
            0.4
          ],
          [
            "finance",
            0.48571428571428565
          ]
        ]
      },
      {
        "id": "cloud_payment_outage",
        "name": "Cloud, payment and communications outage",
        "weight": 0.13,
        "severity": 1.0,
        "scores": {
          "supplies": 0.6474857142857142,
          "health": 0.72,
          "shelter": 0.741,
          "communication": 0.43999999999999995,
          "identity": 0.62,
          "finance": 0.3691428571428571,
          "digital": 0.45386666666666664,
          "information": 0.58,
          "ai_authority": 0.72,
          "mobility": 0.66,
          "community": 0.72,
          "psychological": 0.78
        },
        "floor": 0.3691428571428571,
        "weakest": [
          [
            "finance",
            0.3691428571428571
          ],
          [
            "communication",
            0.43999999999999995
          ],
          [
            "digital",
            0.45386666666666664
          ]
        ]
      },
      {
        "id": "essential_services",
        "name": "Essential-service and supply disruption",
        "weight": 0.13,
        "severity": 1.0,
        "scores": {
          "supplies": 0.3597142857142857,
          "health": 0.43999999999999995,
          "shelter": 0.45599999999999996,
          "communication": 0.72,
          "identity": 0.86,
          "finance": 0.6799999999999998,
          "digital": 0.6314666666666667,
          "information": 0.66,
          "ai_authority": 0.84,
          "mobility": 0.6,
          "community": 0.58,
          "psychological": 0.68
        },
        "floor": 0.3597142857142857,
        "weakest": [
          [
            "supplies",
            0.3597142857142857
          ],
          [
            "health",
            0.43999999999999995
          ],
          [
            "shelter",
            0.45599999999999996
          ]
        ]
      },
      {
        "id": "autonomous_agent_incident",
        "name": "Autonomous-agent or system-control incident",
        "weight": 0.12,
        "severity": 1.0,
        "scores": {
          "supplies": 0.7733857142857142,
          "health": 0.72,
          "shelter": 0.76,
          "communication": 0.62,
          "identity": 0.54,
          "finance": 0.5051428571428571,
          "digital": 0.41439999999999994,
          "information": 0.5,
          "ai_authority": 0.3400000000000001,
          "mobility": 0.76,
          "community": 0.72,
          "psychological": 0.66
        },
        "floor": 0.3400000000000001,
        "weakest": [
          [
            "ai_authority",
            0.3400000000000001
          ],
          [
            "digital",
            0.41439999999999994
          ],
          [
            "information",
            0.5
          ]
        ]
      },
      {
        "id": "local_relocation",
        "name": "Local safety failure and temporary relocation",
        "weight": 0.1,
        "severity": 1.0,
        "scores": {
          "supplies": 0.5036,
          "health": 0.58,
          "shelter": 0.34199999999999997,
          "communication": 0.54,
          "identity": 0.6,
          "finance": 0.6217142857142857,
          "digital": 0.6117333333333334,
          "information": 0.68,
          "ai_authority": 0.84,
          "mobility": 0.3400000000000001,
          "community": 0.52,
          "psychological": 0.56
        },
        "floor": 0.3400000000000001,
        "weakest": [
          [
            "mobility",
            0.3400000000000001
          ],
          [
            "shelter",
            0.34199999999999997
          ],
          [
            "supplies",
            0.5036
          ]
        ]
      },
      {
        "id": "compound_crisis",
        "name": "Compound discontinuity",
        "weight": 0.08,
        "severity": 1.0,
        "scores": {